id	name	description
phs000001	NEI Age-Related Eye Disease Study (AREDS)	The Age-Related Eye Disease Study (AREDS) was initially designed as a long-term multi-center, prospective study of the clinical course of age-related macular degeneration (AMD) and age-related cataract. In addition to  collecting natural history data, AREDS included a clinical trial of high-dose vitamin and mineral supplements for AMD and a clinical trial of high
phs000007	Framingham Cohort	Startup of Framingham Heart Study. Cardiovascular disease (CVD) is the leading cause of death and serious illness in the United States. In 1948, the Framingham Heart Study (FHS) -- under  the direction of the National Heart Institute (now known as the National Heart, Lung, and Blood Institute, NHLBI) -- embarked on a novel and
phs000178	The Cancer Genome Atlas (TCGA)	The Cancer Genome Atlas (TCGA) is a comprehensive and coordinated effort to accelerate our understanding of the molecular basis of cancer through the application of genome analysis technologies, including large-scale  genome sequencing. TCGA is a joint effort of the National Cancer Institute (NCI) and the National Human Genome Research Institute (NHGRI), which are
phs000179	Genetic Epidemiology of COPD (COPDGene)	Chronic obstructive pulmonary disease (COPD) is the fourth leading cause of death in the United States and the only leading cause of death that is steadily increasing in frequency. This  project will establish a racially diverse cohort that is sufficiently large and appropriately designed for genome-wide association analysis of COPD
phs000200	Women's Health Initiative	The Women's Health Initiative (WHI) is a long-term national health study that has focused on strategies for preventing heart disease, breast and colorectal cancer, and osteoporotic fractures in postmenopausal women.  The original WHI study included 161,808 postmenopausal women enrolled between 1993 and 1998. The Fred Hutchinson Cancer Research Center in Seattle
phs000209	Multi-Ethnic Study of Atherosclerosis (MESA) Cohort	MESA The Multi-Ethnic Study of Atherosclerosis (MESA) is a study of the characteristics of subclinical cardiovascular disease (disease detected non-invasively before it has produced clinical signs and symptoms) and the  risk factors that predict progression to clinically overt cardiovascular disease or progression of the subclinical disease. MESA researchers study a
phs000218	National Cancer Institute (NCI) TARGET: Therapeutically Applicable    Research to Generate Effective Treatments	The Therapeutically Applicable Research to Generate Effective Treatments (TARGET) Initiative seeks to accelerate research in novel marker and drug development, along with understanding the molecular basis of pediatric malignancy, through  identification of genomic changes associated with the following childhood cancers: Acute Lymphoblastic Leukemia (ALL) - A fast-growing type of blood
phs000235	National Cancer Institute Cancer Genome Characterization Initiative    (CGCI)	The Office of Cancer Genomics at the National Cancer Institute is sponsoring a series of studies as part of the Cancer Genome Characterization Initiative (CGCI) to assess novel emerging sequencing  technologies in cancer. The CGCI program includes comprehensive characterization of the genetic aberrations found in different pediatric and/or adult
phs000280	Atherosclerosis Risk in Communities (ARIC) Cohort	The Atherosclerosis Risk in Communities (ARIC) Study, sponsored by the National Heart, Lung and Blood Institute (NHLBI), is a prospective epidemiologic study conducted in four U.S. communities. The four communities  are Forsyth County, NC; Jackson, MS; the northwest suburbs of Minneapolis, MN; and Washington County, MD. ARIC is designed to investigate the
phs000285	CARDIA Cohort	CARDIA is a study examining the etiology and natural history of cardiovascular disease beginning in young adulthood. In 1985-1986, a cohort of 5115 healthy black and white men and women  aged 18-30 years were selected to have approximately the same number of people in subgroups of age (18-24 and 25-30), sex, race, and education (high
phs000286	The Jackson Heart Study (JHS)	The Jackson Heart Study (JHS) is a large, community-based, observational study whose participants were recruited from urban and rural areas of the three counties (Hinds, Madison and Rankin) that make  up the Jackson, MS metropolitan statistical area (MSA). Participants were enrolled from each of 4 recruitment pools: random, 17%; volunteer, 30
phs000287	Cardiovascular Health Study (CHS) Cohort: an NHLBI-funded observational    study of risk factors for cardiovascular disease in adults 65 years or    older	The Cardiovascular Health Study (CHS) is a prospective study of risk factors for development and progression of CHD and stroke in people aged 65 years and older. The 5,888 study  participants were recruited from four U.S. communities and have undergone extensive clinic examinations for evaluation of markers of subclinical
phs000631	ARDSnet and the iSPAAR Consortium: Genetic Studies	Acute Respiratory Distress Syndrome (ARDS)/ Acute Lung Injury (ALI) is a syndrome defined by the presence of acute hypoxemic respiratory failure, bilateral pulmonary infiltrates on chest radiograph, a known clinical  risk factor (e.g. sepsis, pneumonia, trauma, gastric fluid aspiration, pancreatitis, massive transfusion), and the absence of physiologic or clinical
phs000640	HeLa Cell Genome Sequencing Studies	This study contains all authorized whole genome sequence data of the HeLa cell line from datasets currently in dbGaP. These data have been approved for health, medical, and/or biomedical research  purposes. Access to these data can be granted for one year. Accessible data will include the studies listed on this page and any additional
phs000653	Epi4K: Gene Discovery in 4,000 Epilepsy Genomes	The Epi4K project began in 2011 as an international, multi-center study that seeks to identify and characterize the genetic bases of complex epilepsies. The Center without Walls Epi4K project includes  three cores and four scientific projects, as well as a steering committee comprised of the primary study investigators and representatives from the
phs000684	Age-Related Macular Degeneration - MMAP Cohort: Association and    Sequencing Studies	Age-related Macular Degeneration (AMD) is a leading cause of incurable blindness in people over the age of 65. AMD is a late-onset multi-factorial neurodegenerative disease and its pathogenesis involves interaction  of genetic and environmental factors. Several chromosomal regions have been associated with AMD susceptibility through linkage analysis (Swaroop et
phs000700	RoadmapEpigenomics_Broad	For the NIH Roadmap Epigenomics project, we applied ChlP-Seq, HTBS and WGBS pipelines to generate comprehensive high-resolution maps of chromatin state and DNA methylation for 100 diverse cell types. Cell  types were selected for their biological and medical importance, and for their potential to maximize the comprehensiveness of acquired epigenomic
phs000703	CATHeterization GENetics (CATHGEN)	The CATHGEN biorepository consists of biological samples collected on 9334 sequential consenting individuals undergoing cardiac catheterization at Duke University Medical Center between 2001 and 2010 inclusive. The Institutional Review Board  informed consent allowed for 50 mL of blood to be collected from fasting patients through the femoral arterial sheath during the catheterization
phs000725	Rare Cancer Tumors Project	A large proportion of common cancers affecting patients around the world have been selected for comprehensive cancer genome studies. Further efforts will be needed to tackle the remaining tumor types,  including the rare forms of cancers. Although rare, these cancers tend to be more aggressive and fast growing with an early recurrence following
phs000743	METSIM (METabolic Syndrome In Men) Study	The METSIM Study includes 10,197 men, aged from 45 to 73 years, randomly selected from the population register of the town of Kuopio, Eastern Finland, and examined in 2005-2010. The  aim of the study is to investigate genetic and non-genetic factors associated with the risk of type 2 diabetes (T2D), cardiovascular disease (CVD
phs000755	BrainSpan Atlas of the Human Brain	The NIH-funded BrainSpan (www.brainspan.org) and PsychENCODE (www.psychencode.org). Consortia sought to generate and analyze multi-dimensional genomics data from the developing and adult human brain in healthy and disease states. One of  the main goals has been to perform large-scale and integrated analysis of the genome, transcriptome, and epigenome of the human brain to broaden our
phs000761	Orofacial Pain: Prospective Evaluation and Risk Assessment (OPPERA)	The OPPERA project has two sub-studies investigating effects of genetic, physiological, psychological and clinical factors on the risk of developing painful temporomandibular disorder (TMD). 1. OPPERA I baseline case-control study  of chronic TMJD (dbGaP study accession phs000762). This sub-study uses a case-control study design to investigate characteristics associated with
phs000788	Research Program on Genes, Environment and Health (RPGEH)	The Kaiser Permanente Research Program on Genes, Environment, and Health (RPGEH) is a resource developed to facilitate research on genetic and environmental factors on common diseases and healthy aging. The  RPGEH resource links biospecimens, health surveys, and comprehensive electronic medical records on broadly consented adult members of Kaiser
phs000801	NCI Non-Hodgkin Lymphoma GWAS	Within the framework of the International Lymphoma Epidemiology Consortium (InterLymph) Consortium and NCI-sponsored Cohort Consortium, investigators from 22 studies came together to conduct a genome-wide association study (GWAS) of non-Hodgkin  lymphoma (NHL). The goal of the study was to identify common genetic variants associated with the risk of NHL. As described previously (Berndt SI et
phs000810	Hispanic Community Health Study /Study of Latinos (HCHS/SOL)	The Hispanic Community Health Study / Study of Latinos (HCHS/SOL) is a multi-center epidemiologic study in Hispanic/Latino populations to determine the role of acculturation in the prevalence and development of  disease, and to identify risk factors playing a protective or harmful role in Hispanics/Latinos. The study is sponsored by the National Heart, Lung
phs000833	Single Cell Analysis Program - Transcriptome (SCAP-T)	This initiative is part of the Single Cell Analysis Program (SCAP) and is funded through the NIH Common Fund (See http://nihroadmap.nih.gov/), which supports cross-cutting programs that are expected to have  exceptionally high impact. Common Fund initiatives address key roadblocks in biomedical research that impede basic scientific discovery and its
phs000842	PediGFR	The Pediatric Investigation for Genetic Factors Associated with Renal Progression (PediGFR) (RO1-DK082394) is an international collaborative study among three large prospective cohort studies of children with chronic kidney disease. The  participating parent cohort studies are the Chronic Kidney Disease in Children (CKiD), the Effect of Strict Blood Pressure Control and ACE Inhibition
phs000847	T2D-GENES: San Antonio Mexican American Family Studies (SAMAFS)	The Type 2 Diabetes (T2D) Genetic Exploration by Next-generation sequencing in Ethnic Samples (T2D-GENES) Consortium is a collaborative international effort to identify genes influencing susceptibility to type 2 diabetes in  multiple ethnic groups using next generation sequencing. To fulfill this objective, T2D-GENES Consortium undertook two large sequencing studies
phs000867	The Finland-United States Investigation of NIDDM Genetics (FUSION) Study	The Finland-United States Investigation of NIDDM Genetics (FUSION) study is a long-term effort to identify genetic variants that predispose to type 2 diabetes (T2D) or that impact the variability of  T2D-related quantitative traits. The initial effort involved linkage analysis of affected-sibling-pair (ASP) families based on over 5,000 individuals
phs000876	Transdisciplinary Research Into Cancer of the Lung (TRICL)	The study was conducted under the auspices of the Transdisciplinary Research In Cancer of the Lung (TRICL) Research Team, which is a part of the Genetic Associations and MEchanisms in  ONcology (GAME-ON) consortium, and associated with the International Lung Cancer Consortium (ILCCO). Ethics All participants provided written
phs000991	VESPA: Vanderbilt Electronic Systems for Pharmacogenomic Assessment	The Vanderbilt Electronic Systems for Pharmacogenomic Assessment (VESPA) Project is a large electronic medical record (EMR)- and biobank-based initiative for translational pharmacogenomics discoveries. Key research resources utilized in this effort  include the BioVU DNA databank and associated Synthetic Derivative database of clinical information, and software tools developed to identify drugs
phs001001	MGH Atrial Fibrillation Study	The Massachusetts General Hospital (MGH) Atrial Fibrillation Study was initiated in 2001. The study has enrolled serial probands, unaffected and affected family members with atrial fibrillation. At enrollment participants undergo  a structured interview to systematically capture their past medical history, AF treatments, and family history. An electrocardiogram is performed
phs001022	PsychENCODE: Autism Transcriptional and Epigenetic Profiling	Our current understanding of autism spectrum disorders (ASD) delineates a highly heritable, yet etiologically heterogeneous disease. Forward genetic approaches to find disease associated mutations or common variation have been successful  and continue to offer considerable power. Yet, given the accumulating evidence for very significant heterogeneity and environmental influences
phs001030	Viral Respiratory Pathogens Genetics	"The overall purpose of this study is to investigate the host genetic factors in response to influenza virus infection, with the focus on influenza vaccination in the first substudy ""Adult  Influenza Vaccine Genetics"" and with the focus on influenza natural infection and other acute respiratory infections (ARIs) in the second substudy"
phs001078	Common Variant GWAS, GECCO	Genetics & Epidemiology of Colorectal Cancer Consortium (GECCO) is a collaborative effort which aims to accelerate the discovery of colorectal cancer-related variants by discovering, replicating and fine-mapping Genome Wide Association  Study (GWAS) findings, conducting a meta-analysis of GWAS data, and investigating how genetic variants are modified by environmental risk factors
phs001120	ELLIPSE Prostate Cancer Meta-Analysis and Genotyping	The ELLIPSE Consortium is an international effort to discover risk loci for prostate cancer. It includes the meta-analysis of existing GWAS data as well as novel GWAS, exome, and iCOGS  genotyping. The GWAS meta-analysis includes the following cases and controls from studies of European ancestry: UK GWAS stage 1 (Illumina Infinium
phs001133	Follow-up of Ovarian Cancer Genetic Association and Interaction Studies    (FOCI)	(Excerpted/paraphrased from original grant application): FOCI seeks to expand our understanding of epithelial ovarian cancer through a coordinated and comprehensive approach. Project 1 will focus on discovery, expansion, and replication.  By pooling GWAS, we expect to identify new associations and achieve independent replication, explore whether there are risk variants specific for
phs001166	Type 2 Diabetes Starr County GWAS and Exome Sequencing	"The T2D Seq GWAS Starr County Cohort is utilized in the following dbGaP sub-studies. To view genotypes, other molecular data, and derived variables collected in these sub-studies, please click on  the following sub-studies below or in the ""Sub-studies"" section of this top-level study page phs001166 T2D Seq GWAS Starr County Cohort. phs000143"
phs001167	Type 2 Diabetes in African Americans, GWAS and Exome Sequencing	"The T2D Seq GWAS AA Cohort is utilized in the following dbGaP sub-studies. To view genotypes, other molecular data, and derived variables collected in these sub-studies, please click on the  following sub-studies below or in the ""Sub-studies"" section of this top-level study page phs001167 T2D Seq GWAS AA Cohort. phs000140 CIDR T2D Bowdens"
phs001172	NINDS Parkinson's Disease	"This study utilized the well characterized collection of North American Caucasians with Parkinson's disease, and neurologically normal controls from the sample population which are banked in the National Institute of  Neurological Disorders and Stroke (NINDS Repository) collection. Two sub-studies are included, in sub-study ""NINDS-Genome-Wide Genotyping in"
phs001175	CTSP: Clinical Trial Sequencing Project	For the Clinical Trials Sequencing Project (CTSP), National Cancer Institute (NCI) will utilize whole genome sequencing and/or whole exome sequencing in conjunction with transcriptome sequencing to try to identify recurrent  genetic alterations (mutations, deletions, amplifications, rearrangements) and/or gene expression signatures that would be important to the
phs001180	Genes-Environments and Admixture in Latino Asthmatics (GALA II) Study	A case-control pharmacogenetic study of bronchodilator drug response among racially admixed Latino children with asthma. Each participant had two spirometry measurements using the KoKo PFT System. With the first spirometry  test, participant was administered with 4 puffs of HFA Albuterol. The second albuterol measurement was based on age, for participants under 16 years
phs001194	Pediatric Cardiac Genetics Consortium (PCGC) Study	Multi-center, prospective observational cohort study of individuals with congenital heart defects (CHD). Phenotypic data and source DNA derived from 10,000 probands, parents, and families of interest are being collected to  investigate relationships between genetic factors and phenotypic and clinical outcomes in patients with CHD. The PCGC Cohort is utilized in the
phs001238	Genetic Epidemiology Network of Arteriopathy (GENOA)	The Genetic Epidemiology Network of Arteriopathy (GENOA) is one of four networks in the NHLBI Family-Blood Pressure Program (FBPP). GENOA's long-term objective is to elucidate the genetics of target organ  complications of hypertension, including both atherosclerotic and arteriolosclerotic complications involving the heart, brain, kidneys, and
phs001300	NABEC: North American Brain Expression Consortium	This study utilized neurologically normal control samples deposited in North American Brain Expression Consortium (NABEC). This top-level study, phs001300, makes available all phenotype data of the NABEC study participants. In  addition, molecular data of six sub-studies are available through dbGaP: 1. NABEC Genome-Wide Genotyping - phs000249 2. NABEC Exome Sequencing
phs001304	NCI Biospecimen Pre-analytical Variables (BPV) Analysis	The Biospecimen Pre-analytical Variables (BPV) Program is a National Cancer Institute-sponsored study to systematically assess the effects of pre-analytical factors on the molecular profile of biospecimens. A robust biospecimen collection  infrastructure was established to prospectively collect biospecimens using rigorous standard operating procedures to control for most variables while
phs001475	Genes Influencing Susceptibility to Infection and Malnutrition	NIH birth cohort study Amebiasis is a common cause of diarrhea and is associated with malnutrition in grade-school aged children in an urban slum of Dhaka, Bangladesh. Field Studies of  Human Immunity to Amebiasis in Bangladesh was designed to determine the contribution of amebiasis to illness in the first 2 years of life when most
phs001683	CSER: Incorporation of Genomic Sequencing into Pediatric Cancer Care	This project includes data derived from subjects enrolled in the BASIC3 (Baylor College of Medicine Advancing Sequencing in Childhood Cancer Care) study. BASIC3 is a National Genome Human Research Institute  (NHGRI) and National Cancer Institute-funded Clinical Sequencing Exploratory Research (CSER) consortium project that focused on prospective
phs002073	Effect of Breast Feeding on Immunologic Priming in Young Infants	The mechanisms generating immunoglobulin heavy chain (IgH) biodiversity result in over potentially unique immunoglobulin sequences within an individual. However, over the course of B cell development, B cell receptor (BCR)  selection constrains the repertoire significantly. In newborn infants compared to adults, developmental regulation of terminal deoxynucleotidyl
phs002793	Study of Lyme Immunology and Clinical Events (SLICE)	The overall objective of this study is to measure risk factors, symptom patterns and severity, longitudinal course, and associated biomarkers in patients who develop symptoms of post treatment Lyme disease  (PTLD) in cohort studies. Principal Investigator: John Aucott, MD, Lyme Disease Research Center, Division of Rheumatology, Department of Medicine
phs000016	International Multi-Center ADHD Genetics Project	The goal of the project is to complete a 600,000 tag SNP genome-wide association scan of 958 parent-child trios from the International Multisite ADHD Genetics (IMAGE) project, in order to  assess the association of SNP markers with ADHD, analyze quantitative ADHD phenotypes, complete copy number analyses, assess parent of origin effects
phs000017	Whole Genome Association Study of Bipolar Disorder	The goal of the project is to identify genes that make individuals more susceptible to bipolar disorder (manic depressive illness) and to better understand the brain pathways involved in the  disease. Dataset versioning Version 1: European-American (EA) ancestry only Version 2: Version 1 plus African-American (AA) ancestry Version 3: EA
phs000018	Search for Susceptibility Genes for Diabetic Nephropathy in Type 1    Diabetes (GoKinD study participants), GAIN	Genetics of Kidneys in Diabetes (GoKinD) study is an initiative aimed at identifying susceptibility genes for diabetic nephropathy in type 1 diabetes. A large number of individuals with type 1  diabetes were screened to identify two subsets, one with clear-cut kidney disease and another with normal renal status despite long-term diabetes
phs000019	Collaborative Association Study of Psoriasis	The goal of this collaborative study is to combine the resources and expertise of three groups with long-standing studies of psoriasis genetics in order to identify new genetic susceptibility factors  for psoriasis, a common inflammatory skin disease that affects over 4 million Americans. Consent groups and participant set General research use (GRU
phs000020	Major Depression: Stage 1 Genomewide Association in Population-Based    Samples	Identification of genomic regions that confer susceptibility to or protection from major depressive disorder (MDD) via genomewide association. Consent groups and participant set Psychiatric and Related Somatic Conditions (PRSC): 3741  (1821 cases, 1822 controls, 98 others) Case selection: MDD cases were recruited through mental health care organizations, general practices and in
phs000021	Genome-Wide Association Study of Schizophrenia	The goal of the study is to find susceptibility genes for schizophrenia. Dataset versioning Version 1: European-American (EA) ancestry only Version 2: Version 1 plus African-American (AA) ancestry Consent groups  and participant set General research use (GRU): 4591 cases and controls (1217 EA cases, 1442 EA controls, 953 AA cases, 979 AA controls) This consent
phs000048	Mayo-Perlegen LEAPS (Linked Efforts to Accelerate Parkinson's Solutions)    Collaboration	We performed a two-tiered, whole-genome association study of Parkinson disease (PD). For tier 1, we individually genotyped 198,345 uniformly spaced and informative single-nucleotide polymorphisms (SNPs) in 443 sibling pairs discordant  for PD. For tier 2a, we individually genotyped 1,793 PD-associated SNPs (P .01 in tier 1) and 300 genomic control SNPs in 332 matched case-unrelated
phs000049	Genotyping the 270 HapMap Samples for GAIN by Broad	"The Broad Institute Center for Genotyping and Analysis is an NCRR-funded fee-for-service SNP genotyping facility based at MIT (www.broad.mit.edu/genotyping). For the GAIN studies, Broad uses the Affymetrix GeneChip genotyping platform.  The first set of studies is being analyzed on the soon-to-be-publicly-released ""Human Mapping 500K Array 2.0"", which detects 500,000 SNPs, as well as"
phs000050	Genotyping the 270 HapMap Samples for GAIN by Perlegen	For the GAIN studies, Perlegen Sciences uses a high-density oligonucleotide array-based platform to analyze 600,000 SNPs in large numbers of individuals. The SNP set was selected on the basis of  linkage disequilibrium analysis of the HapMap data, and includes tag SNPs for all CEU bins. The arrays consist of DNA probes (short segments of DNA
phs000086	DCCT-EDIC Clinical Trial and Follow-up of Persons with Type 1 Diabetes	The Diabetes Control and Complications Trial (DCCT, 1982-93) and the Epidemiology of Diabetes Interventions and Complications follow-up study (EDIC, 1994-2016) have been ongoing for more than twenty years. After a  mean follow-up of approximately 16 years, the DCCT-EDIC cohort of 1,441 Type 1 diabetics had remained remarkably complete with more than 90% of the
phs000088	Search for Susceptibility Genes for Diabetic Nephropathy in Type 1    Diabetes (GoKinD study participants and parents), NIDDK	Genetics of Kidneys in Diabetes (GoKinD) study is an initiative aimed at identifying susceptibility genes for diabetic nephropathy in type 1 diabetes. A large number of individuals with type 1  diabetes were screened to identify two subsets, one with clear-cut kidney disease and another with normal renal status despite long-term diabetes
