id	name	description
phs000728	Lung Cancer Susceptibility in Smokers	Over 85% of all patients diagnosed with lung cancer report a history of tobacco use, though only 10% of tobacco smokers eventually develop lung cancer. Epidemiologic studies have shown that  family members of patients with lung cancer have a higher risk of developing lung cancer than controls. In an effort to identify variants associated
phs000729	Follicular Lymphoma 2013 - Malek	A cohort of follicular lymphoma cases had tumor cells purified from tissue samples after informed consent using flow cytometry. DNA was extracted from the cells, and samples were subjected to  solution-based exome capture using the Illumina TruSeq Exome Enrichment Kit and the Illumina HiSeq 2000 platform. Patients were enrolled between 2008
phs000730	Genomics of Brain Metastases	Brain metastases are the most frequently occurring intracranial tumors in adults. Median survival after the diagnosis of a brain metastasis is in the order of a few months. Despite its  large burden of disease and devastating clinical sequelae, we continue to have a limited understanding of the molecular mechanisms driving brain
phs000732	L1-seq and genome-wide SNP genotyping in a multiethnic Asian population	Insertions of the human-specific subfamily of LINE-1 (L1) retrotransposon are highly polymorphic across individuals and can critically influence the human transcriptome. We hypothesized that L1 insertions could represent genetic variants  determining important human phenotypic traits, and performed an integrated analysis of L1 elements and single nucleotide polymorphisms (SNPs) in
phs000733	ICPCG Genome Wide Association Study of Familial Prostate Cancer	Initially, the ICPCG focused largely on high-risk prostate cancer pedigrees using linkage analysis. However, association studies have also been informative to find prostate cancer susceptibility variants in the genome. We  hypothesize that genome-wide (GW) association studies of familial cases of prostate cancer will have the power to identify rarer and perhaps less
phs000734	Osteosarcoma Genome-Wide Association Study	This is a genome-wide association study (GWAS) of osteosarcoma, the most common primary bone malignancy. Osteosarcoma typically occurs in adolescents and young adults. It occurs at increased frequency in several  inherited cancer predisposition syndromes but the genetic contribution to sporadic osteosarcoma is largely unexplored. The objective of this study
phs000735	The Placenta Harbors a Unique Microbiome	This study is to investigate placental microbiome through 16S rDNA-based and whole genome shotgun metagenomic sequencing. Identified taxa and their gene carriage patterns were compared to other human body sites  niches. The placental microbiome profiles were most akin to the human oral microbiome. Exclusion Criteria Subjects with fatal fetal anomalies, fetal
phs000737	NIDDK Genetics of Metabolic Syndrome in an Island Population	The major objective of this study was to conduct a systematic genetic study of metabolic traits involved in metabolic syndrome through collection and analysis of epidemiological, demographic, environmental, and relevant  biological and clinical data from a relatively isolated island population of the eastern Adriatic coast of Croatia. The population was chosen for the
phs000738	Exome Sequencing in Schizophrenia Families	Schizophrenia is a complex neuropsychiatric disorder characterized by marked genetic heterogeneity. Much of the genetic architecture of the disorder has yet to be explained, but de novo mutations appear to  play an important role. We used exome sequencing of parent-offspring quads and trios to detect de novo mutations in persons with schizophrenia
phs000739	Identification of Recurrent SMO and BRAF Mutations in Ameloblastomas	RNA-seq data from two cases of ameloblastoma was analyzed for candidate gene fusions and point mutations. Recurrent point mutations identified in the RNA-seq data, as well as mutations identified with  limited panel targeted deep sequencing, were validated as somatic. Expanding to a larger cohort of 28, one of two activating mutations was found in
phs000740	Whole Genome Sequencing of Waldenstrom's Macroglobulinemia	Whole genome sequencing was conducted on 10 tumor/germline paired samples along with 20 additional unpaired tumor samples from patients with Waldesntrom's macroglobulinemia. Tumor lymphoplasmacytic lymphoma cells were obtained from CD19+  selected bone marrow mononuclear cells. Germline tissue was obtained from CD19 depleted peripheral blood mononuclear cells. High molecular weight DNA
phs000741	Genetics of Lipid Lowering Drugs and Diet Network (GOLDN) Lipidomics    Study	The GOLDN study was initiated to assess how genetic factors interact with environmental (diet and drug) interventions to influence blood levels of triglycerides and other atherogenic lipid species and inflammation  markers (registered at clinicaltrails.gov, number NCT00083369). The study recruited Caucasian participants primarily from three-generational
phs000742	The Epilepsy Phenome/Genome Project	The Epilepsy Phenome/Genome Project (EPGP) is a large-scale, international, multi-institutional, collaborative research project, sponsored by the National Institute of Neurological Disorders and Stroke, designed to understand the genes that cause  common and rare epilepsies. The overall goal of EPGP is to collect detailed, high quality phenotypic (i.e., characteristics of individuals, from the
phs000744	Yale Center for Mendelian Genomics (Y CMG)	Yale University is home to one of three national centers created by the NIH to study the genetics of rare inherited diseases. Researchers at Yale, the University of Washington, and  a center operated jointly by Baylor and Johns Hopkins University will analyze the genomes of thousands of patients who suffer from more than 6,000
phs000745	RNAseq analysis of posterior cingulate astrocytes in Alzheimer's disease	In this study, RNA sequencing was performed on astrocytes microdissected from the posterior cingulate cortex of Alzheimer's disease subjects and healthy elderly controls. Alzheimer's subjects had expired ages 65, frequent  plaque densities, Braak scores of at least IV, and intermediate to high criteria met for NIA-R. Healthy elderly controls had expired ages of 65, zero
phs000747	Whole Exome and Transcriptome Sequencing in Sporadic ALS	Amyotrophic lateral sclerosis (ALS), also known as Lou Gehrig's disease, is a fatal and devastating neurodegenerative disorder that causes the progressive death of upper and lower motor neurons. Although many  efforts have been done to elucidate molecular factors involved in the onset and progression of the disorder, the causes of ALS are yet unknown and
phs000748	Multiple Myeloma CoMMpass Study	The Multiple Myeloma Research Foundation (MMRF) CoMMpass (Relating Clinical Outcomes in MM to Personal Assessment of Genetic Profile) trial (NCT01454297) is a longitudinal observation study of 1000 newly diagnosed myeloma  patients receiving various standard approved treatments that aim at collecting tissue samples, genetic information, Quality of Life (QoL) and various
phs000750	Genomic Origins and Admixture in Latinos (GOAL)	The GOAL Study was designed to comprehensively evaluate the genomic architecture of diverse Hispanic/Latino individuals with origins from the Caribbean, Central and South America, and to understand the impact of  this diversity on genetic disease studies. Population structure and admixture are key confounders in genome-wide association and medical resequencing
phs000751	GWAS in Fibrosing Interstitial Lung Disease	This study was a case-control genome-wide association study of 1616 non-Hispanic white cases and 4683 controls. Under an additive model for the minor allele at each SNP, we identified 19  SNPs, representing 7 chromosomal locations (5p15, 6p24, 7q22, 11p15, 15q14-15, 17q21, and 19p13), with genome-wide significant (P 5x10-8
phs000753	High Density SNP Association Analysis of Lung Cancer	This research builds upon an extensive resource of a case-control study that has been ongoing at the UT MD Anderson Cancer Center since 1991. To identify risk variants for lung  cancer, we conducted a genome-wide association study. Cases are newly diagnosed, histologically-confirmed patients presenting at MD Anderson Cancer
phs000756	Exome Sequence of Finnish Sub-Isolate Samples from the FINRISK Cohort	We propose to undertake, at the McDonnell Genome Institute of Washington University, a collaborative exome sequencing project of 10,000 samples from a large Finnish population cohort, FINRISK, a participating component  of the Sequencing Initiative Suomi (SISu) consortium. Together these sequenced samples will provide a unique resource for identification of
phs000757	Ataxia Gene Identification by Integrated Genomic Analysis	Ataxias are a group of diseases that result in a lack of coordinated muscle movement. Hereditary ataxias are genetically heterogeneous and it is reported that 40% of suspected genetic ataxias  currently have an unknown cause. We used exome sequencing to detect mutations responsible for ataxia. We sequenced, when available, multiple
phs000758	Family Genomics of Congenital Heart Defects	The study identified the causal mutation in a five-generation pedigree harboring a cardiac septal defect. The inheritance pattern is consistent with an autosomal dominant mutation with high penetrance. We performed  whole-genome sequencing (Complete Genomics) on 21 individuals in the pedigree, of which 11 individuals are affected. We identified a single gene
phs000759	Spectrum of Mutations in Myeloid Neoplasms	Patients with myeloid malignancies bearing high-risk cytogenetic abnormalities lack effective therapies and have a poor overall survival. -7/del(7q) is identified in half of high-risk myeloid neoplasms. We recently identified CUX1  to be a haploinsufficient myeloid tumor suppressor gene located within the commonly deleted segment of 7q22. Here we identify the spectrum of somatic
phs000760	Human Responses to Influenza Vaccination	The data consist of the DNA sequences of antibody gene rearrangements from peripheral blood human B cells of subjects vaccinated with trivalent seasonal influenza or monovalent pandemic H1N1 vaccine. Multiple  replicate libraries of immunoglobulin heavy chain gene rearrangements were prepared from each subject for each time point. The seven healthy vaccine
phs000763	The Collaborative Study on the Genetics of Alcoholism (COGA)	COGA is a family study of alcoholism, in which the subjects have been drawn from the Collaborative Study on the Genetics of Alcoholism (COGA), a large, ongoing family-based study that  includes subjects from seven sites around the US. COGA has gathered detailed, standardized data on study participants, including diagnostic and
phs000766	GEI Studies - Psoriasis	The GEI Studies Project was started as an NIH consortium involving 5 disease groups with funding provided through the Genes, Environment, and Health Initiative (GEI). The objective of the project  was to optimize strategies for identifying rare variants as a follow up to genome-wide association studies (GWAS) using next-generation sequencing
phs000767	The UC San Diego Chronic Lymphocytic Leukemia (CLL) Study	The UC San Diego Chronic Lymphocytic Leukemia Study is designed to identify genetic, epigenetic, and transcriptional changes important for CLL. This data release consists of samples collected to 1) identify  genomic changes associated with CLL progression using serially collected tumor samples; 2) characterize the transcriptional consequences of SF3B1
phs000768	Genomic Sequencing of Ewing's Sarcoma	The Ewing sarcoma family of tumors (EFT) is a group of malignant small round blue cell tumors that arise in bone or soft tissue. Ewing sarcoma (ES) is the second  most common type of primary bone tumor to affect children and adolescents and accounts for 2.9% of all childhood cancers. This data set reports whole
phs000769	NHLBI Lung HIV Microbiome Project (LHMP)	Humans interact with countless microorganisms in multiple environments. The Lung HIV Microbiome Project (LHMP) characterized the microbiome of the lung and respiratory tract. This effort provided initial data to develop  further hypotheses addressing differences between HIV-infected and HIV-uninfected individuals. The project involved multiple studies, either single
phs000770	Somatic Mutation Profile by Next Generation Sequencing in HER2+ Breast    Cancer	The HER pathway is the driving force behind 30% of human breast cancers. It is important to understand how targeted therapies block different cellular pathways, and mechanisms of escape from  this blockage. Therapies directed at HER2 establish a successful treatment paradigm, but de novo and acquired resistance exist. The HER signaling
phs000771	Bladder Cancer Clinical Cohorts	Cisplatin-based chemotherapy is the standard of care for patients with muscle invasive urothelial carcinoma. Pathologic downstaging to pT0/pTis after neoadjuvant cisplatin-based chemotherapy is associated with improved survival, and some patients  with metastatic disease achieve complete responses to these therapies. However, the molecular determinants of cisplatin response are incompletely
phs000772	Genetic Predictors of Adverse Radiotherapy Effects (Gene-PARE)	The goal of this study was to identify SNPs and CNPs that are associated with development of normal tissue toxicities resulting from radiotherapy for prostate cancer. The study population includes  approximately 1,400 men treated with brachytherapy, external beam radiation therapy, or a combination of the two treatments, and assessed for adverse
phs000773	CTLA4:CD28 in Sezary Syndrome	We sequenced two tumor and one normal whole genome libraries for a Sezary syndrome patient and also sequenced RNA libraries for each tumor. We identified a novel, highly expressed CTLA4:CD28  gene fusion that is predicted to results in a leading to stimulatory T-cell signaling in the presence of an inhibitory signal. Principal Investigator
phs000774	CCDG: Genetics of Orofacial Clefts and Related Phenotypes	The purpose of this study is to investigate the genetics of orofacial clefts (OFCs) in a large study population, and importantly, to incorporate subclinical phenotypic features into these studies. Orofacial  clefts (OFCs) comprise a significant fraction of human birth defects (about 1/700 live births (Rahimov et al. 2012) and represent a major public
phs000775	Joint Genome-Wide Gene Expression and GWAS Mapping in the MGS Dataset	Schizophrenia is a common and severe psychotic disorder. While some common SNPs and rare copy number variants have been identified as being significantly associated with disease risk, the biological mechanisms  remain undefined. To identify gene expression abnormalities in schizophrenia, we generated whole-genome gene expression profiles using microarrays on
phs000776	Consanguinity and Rare Mutations Outside of MCCC Genes Underlie    Non-Specific Phenotypes of MCC Deficiency	3-Methylcrotonyl-CoA Carboxylase Deficiency (MCCD) is an autosomal recessive disorder of leucine catabolism, which has a highly variable clinical phenotype, ranging from acute metabolic acidosis to non-specific symptoms such as developmental  delay, failure to thrive, hemiparesis, muscular hypotonia, and multiple sclerosis. Implementation of newborn screening for MCCD has resulted in
phs000777	NIDDK Gene discovery in FSGS	Focal segmental glomerulosclerosis (FSGS) is a frequent cause of end-stage renal disease. The pathogenesis of FSGS has not been precisely defined and there are no consistently effective treatments. Recent studies  identifying causal genes in rare, inherited FSGS, including our own study, have associated mutations in at least six genes with familial FSGS, and
phs000778	NIDDK Gene discovery in VUR	Primary vesicoureteric reflux (PVUR), or non-syndromic VUR, is the most common type of congenital anomaly of the kidney and the urinary tract (CAKUT). PVUR is the single most important risk  factor for pyelonephritis and renal parenchymal scarring in the pediatric age group. Renal parenchymal scarring due to PVUR is referred to as reflux
phs000779	OFCCR SNP-CpG	We profiled the methylation landscape of 2100 DNA samples ( 1100 cases of colorectal cancer and 1000 controls) from the Ontario Familial Colon Cancer Registry (OFCCR) using the HumanMethylation450 array  from Illumina. DNA was extracted from lymphocyte pellets, except for 99 samples for which DNA was extracted from lymphoblastoid cell lines. Samples
phs000780	Exome Sequencing of Childhood Wilms Tumor	Wilms tumor is the most common kidney cancer of children. To define the mutation spectrum of Wilms tumor, we performed whole-exome sequencing on matched tumor-normal pairs. A further set of  tumor samples underwent whole exome sequencing without accompanying normal tissue. Exome data for patients giving consent to have the information
phs000781	Children's Hospital of Philadelphia: GWAS of Left-Sided Cardiac Defects	This is a family-based genome-wide association study of congenital left-sided cardiac lesions (LSLs). Cases with LSLs and their parents were recruited from the Cardiac Center at The Children's Hospital of  Philadelphia between 1997 and 2010. The discovery dataset included 405 LSL case-parent triads. DNA was extracted from blood or saliva samples from
phs000782	Post-Liver Transplant Recurrent Human Hepatocellular Carcinoma Study    (RHCCS)	The whole exome sequencing showed that HERC5 deletion and under-expression associates with shorter: time to tumor recurrence, progression-free, and overall survival in hepatocellular carcinoma (HCC) in two independent studies (p1  0.004, HR1 1.80; p2 0.018, HR2 3.31) totaling 286 HCC patients. Matched primary and recurrent tumors indicated a clonal selection advantage in
phs000783	Gene Mutation and Rescue in Human Congenital Diaphragmatic Hernia (CDH)	Congenital diaphragmatic hernia (CDH) is a common and severe birth defect characterized by structural defects of the diaphragm and by pulmonary hypoplasia. Congenital diaphragmatic hernia patient may present either as  an isolated phenotype or together with other congenital anomalies in a complex phenotype. Despite the clinical significance of CDH, the underlying
phs000784	Genetic Epidemiology Network of Salt Sensitivity (GenSalt)	The GenSalt study is aimed at identifying novel genes which interact with the effect of dietary sodium and potassium intake or cold pressor on blood pressure. Inclusion criteria for proband  Men or women aged 18-60 years Systolic BP 130-160mm Hg and/or diastolic BP 85-100mm Hg Both parents (two-generation nuclear family) or at least one
phs000785	Sequencing Analysis of Cutaneous Squamous Cell Carcinoma	The Exome Sequencing Analysis of Cutaneous Squamous Cell Carcinoma (SCC) study is a single-center cohort study. To identify recurrent genomic aberrations that might underlie the development of this malignancy, we  performed whole exome sequencing on a series of SCC-normal pairs to distill a list of 336 candidate genes that were subsequently re-sequenced in 100
phs000787	Immunosenescence: Immunity in the Young and Aged	The study sequenced TCRB gene rearrangements from young versus elderly human subjects. Inclusion: Healthy apheresis platelet donors Aged 20-35 years, or 70-85 years Exclusion: History of autoimmune disease History of  diabetes mellitus History of chemotherapy Co-principal Investigators: Scott D. Boyd, MD, PhD, Stanford University, Stanford, CA, USA Co-principal
phs000789	Collaborative Study of Genes, Nutrients and Metabolites (CSGNM)	While many genetic and metabolic studies focus on understanding disease states, this genome wide association study (GWAS) was designed to understand the influence of genetic variants on circulating metabolites and  factors in normal, healthy individuals. Over 2500 healthy, ethnically Irish college students attending Trinity College Dublin completed a health and
phs000790	Comparative Analysis of Primary and Metastatic Colorectal Cancer	Molecular profiling for somatic mutations that predict response to anti-EGFR therapy in colorectal cancer (CRC) has become standard practice. However, abundant tissue from metastatic lesions is not always available from  patients with metastatic CRC. Concerns involving genetic heterogeneity between primary and metastatic lesions have called into question the
phs000791	Integrated Epigenetic Maps of Human Embryonic, Extraembryonic and Adult    Cells	Working cooperatively with other Mapping Centers and the Data Coordination Center (EDACC) funded by this Roadmap mechanism we have comprehensively mapped the epigenomes of select human cells with significant relevance  to complex human disease. Our effort has been focused on cells relevant to human health and complex disease including cells from the blood, brain
phs000792	Oncogenomics of Malignant Peripheral Nerve Sheath Tumors	Malignant peripheral nerve sheath tumors (MPNSTs) are a group of highly aggressive soft tissue sarcomas that may occur sporadically, in association with neurofibromatosis type I (NF1-associated), or after radiotherapy (RT-associated).  We utilized comprehensive genomic approaches and identified recurrent loss-of-function somatic alterations in the Polycomb repressive complex 2 (PRC2
phs000793	Paired AML Epigenetics Study on Clonality	We describe methclone, a novel method to identify epigenetic loci that harbor large changes in the clonality of their epialleles (epigenetic alleles). Methclone efficiently analyzes genome-wide DNA methylation sequencing data.  We quantify the changes using a composition entropy difference calculation and also introduce a new measure of global clonality shift, loci with
phs000794	Longitudinal Genome-Wide Analysis of Patients with Chronic Lymphocytic    Leukemia	Samples from two-center prospective phase 2 clinical trail conducted at Ohio State University (Columbus, OH) and Mayo Clinic (Rochester, MN) were analyzed in 12 cases. All patients had progressive CLL  as defined by National Cancer Institute (NCI) Working Group criteria. Patients provided written informed consent for correlative studies according to
phs000795	Gastric Cancer Genetic Analysis of Metastasis	To identify candidate drivers involved in oncogenesis and tumor evolution, we conducted an extensive genome sequencing analysis of metastatic progression in diffuse gastric cancer. This involved a comparison between a  primary tumor from a Hereditary Diffuse Gastric Cancer Syndrome proband and its subsequent recurrence as an ovarian metastasis. Principal
phs000796	Genome Wide Association Study of Chronic TMD: Discovery Phase	The OPPERA project is investigating effects of genetic, physiological, psychological and clinical factors on the risk of developing painful temporomandibular disorder (TMD). This case-control study is a discovery-phase genome wide  association study that aims to identify commonly-occurring genetic variants associated with chronic TMD. It represents the first step in a series of
phs000797	CTLA4 haploinsufficiency and immune dysregulation	We identified germline heterozygous mutations in CTLA4 in members of four families with severe immune dysregulation. Human CTLA4 haploinsufficiency caused dysregulation of FoxP3+ regulatory T (Treg) cells and lymphocytic infiltration  of target organs, mimicking Ctla4 homozygous mice. Patients also exhibited a B cell phenotype, with progressive loss of B cells and accumulation of
phs000798	Performance Characteristics of Selective Targeted Enrichment in Genetic    Diagnostic Testing	The Nex-StoCT and ACMG recommend that validation of an NGS-based diagnostic test include performance test characteristics for assay accuracy, analytical sensitivity and specificity, reproducibility and repeatability. To measure these parameters  for the GEDi capture and sequencing test, 4 samples (three randomly selected patient samples and the NA12878 HapMap sample) were prepared and
phs000799	Shanghai Breast Cancer Genetics Study (SBCGS)	The Shanghai Breast Cancer Genetics Study (SBCGS) includes data from four population-based studies conducted among Chinese women in urban Shanghai: the Shanghai Breast Cancer Study (SBCS), the Shanghai Breast Cancer  Survival Study (SBCSS), the Shanghai Women's Health Study (SWHS), and the Shanghai Endometrial Cancer Study (SECS, contributing controls only
phs000803	Gastorointestinal Cancer Clinical Cohorts	Comprehensive genomic profiling of colon adenocarcinomas has revealed multiple recurrent alterations that may inform new treatment strategies. Clinical trials of these agents are ongoing, although the mechanisms of response and  resistance to these agents are not well characterized. The goal of this study is to perform comprehensive profiling of pre-treatment and post
phs000804	Genomic Sequencing of Ewing Sarcoma	Pediatric Ewing sarcoma is a pediatric cancer that primarily arises from the bone. It is characterized by chimeric fusions of the EWS gene and an ETS family transcription factor. In  this study, we performed massively parallel sequencing of a larger collection of Ewing sarcoma tumors to define the genomic landscape of this disease
phs000806	MIGen_ExS: Ottawa Heart Study	The Ottawa Heart Study is a cross-sectional case-control study designed to identify genes that predispose to angiographically defined coronary artery disease. All exome sequencing was performed at the Broad Institute  of Harvard and MIT; samples sequence capture was performed using Agilent SureSelect Human All Exon Kit v2 and sequencing was performed on an Illumina
