id	name	description
phs001366	Pilot Study of Exome and mRNA Profiling in Small Cell Lung Cancer    Patients	In this prospective study, custom genome-wide exome and whole transcriptome sequencing (NGS) was used to identify genomic events and associated expression changes in advanced Small Cell Lung Cancer (SCLC) and  attempt to prescribe systemic therapy based on the results. Tumor/normal pairs were sequenced from 12 patients with advanced SCLC for this study. To
phs001367	Add Health: The National Longitudinal Study of Adolescent to Adult Health    (Add Health)	The National Longitudinal Study of Adolescent to Adult Health [Add Health] is an ongoing longitudinal study of a nationally representative U.S. cohort of more than 20,000 adolescents in grades 7-12  (aged 12-19 years) in 1994 followed into adulthood with five interviews/surveys in 1995, 1996, 2001-02, 2008, and 2016-18. Add Health was designed to
phs001368	NHLBI TOPMed: Trans-Omics for Precision Medicine (TOPMed) Whole Genome    Sequencing Project: Cardiovascular Health Study	Participants from the Cardiovascular Health Study (CHS), a large population-based longitudinal cohort study (phs000287), have been included in the TOPMed project. Whole genome sequencing will be performed to contribute to  multiple analyses, including cardiovascular disease risk factors, subclinical disease measures, the occurrence of myocardial infarction (MI) and
phs001369	Germline hypomorphic CARD11 mutations in severe atopic disease	We described five patients from four unrelated families who had severe atopic dermatitis and susceptibility to mild skin viral infections. Some patients also exhibited other allergic symptoms such as asthma  and food allergy. We performed targeted sequencing for affected patients A-I of family A and B-I of family B, whole exome sequencing for D-I, D-II.1
phs001370	Whole Exome Sequencing of Uveal Melanoma	Uveal melanoma is a rare form of melanoma that occurs in the eye and has no effective treatment once metastatic. To further characterize the genomic events driving uveal melanoma, whole  exome sequencing was performed on 61 primary tumors derived from enucleations, 3 liver metasases, and paired normal DNA. Recurrent somatic genetic
phs001371	Inflammation-Induced Stabilization of mRNA in Rheumatoid Arthritis	During rheumatoid arthritis (RA), TNF activates fibroblast-like synoviocytes (FLS) inducing in a temporal order a constellation of genes, which perpetuate synovial inflammation. Although the molecular mechanisms regulating TNF-induced transcription are  well characterized, little is known about the impact of mRNA stability on gene expression and the impact of TNF on decay rates of mRNA transcripts in
phs001372	Integrated Single-Cell Analysis in Chronic Lymphocytic Leukemia	Intratumoral genetic heterogeneity has been characterized across cancers by genome sequencing of bulk tumors, including chronic lymphocytic leukemia (CLL). In order to more accurately identify subclones, define phylogenetic relationships, and  probe genotype-phenotype relationships, we developed methods for targeted mutation detection in DNA and RNA isolated from thousands of single cells
phs001373	Mechanisms Controlling Gene Expression of Human Microglia	These studies map the epigenetic landscape of microglia, neurons, astrocytes and oligodendrocytes. The initial study compared acutely isolated microglia to cultured microglia from the same donors, to identify changes that  occur when microglia are removed from the brain microenvironment. In collaboration with the Rady Children's hospital, we obtained brain tissue
phs001374	VA APOLLO Project - Research for Precision Oncology (RePOP)	The Research for Precision Oncology Program (RePOP) is a research activity that establishes a cohort of Veterans diagnosed with cancer and who have had genomic analyses performed on their tumor  tissue as part of standard of care. All data relevant to a patient's cancer and cancer care will be collected under RePOP, including patient
phs001375	Slim Initiative in Genomic Medicine for the Americas (SIGMA): Mexico City    Diabetes Study (MCDS)	The 52,000 sample Type 2 Diabetes Exome Sequencing project is a collaboration of six consortia with various funding mechanisms that have joined together to investigate genetic variants for type 2  diabetes (T2D) using the largest T2D case/control sample set compiled to date. This includes samples from: Type 2 Diabetes Genetic Exploration by
phs001376	Autosomal Recessive CD55 Deficiency	We describe 11 patients from 8 families with homozygous LOF mutations in the complement regulatory protein CD55. Loss of CD55 is associated with increased complement activation, severe protein losing enteropathy  accompanying a primary intestinal lymphangiectasia, and deep vein thrombotic events. We have named this disease CHAPLE after the principle components
phs001377	Epigenetics of Cocaine and Nicotine Addiction	This project characterizes DNA methylation and gene expression changes that occur in the human brain, specifically in neurons from the rostral striatum. Major advances from NIDA funded initiatives for noninvasive  neuroimaging studies have made it possible to study neuroanatomical, neurochemical and functional changes in the human brain that contribute to the
phs001378	scRNA-Seq Reveals Lymphoma B Cell Diversity and T Cell Immune Checkpoint    Co-Expression	Follicular lymphoma (FL) is a generally incurable B-cell malignancy which has the potential to transform into highly aggressive lymphomas. Genomic studies indicate it is often a small subpopulation rather than  the dominant population in the FL that gives rise to the more aggressive subtype. To resolve the underlying transcriptional networks of follicular B
phs001380	Genomic Studies of Gilles de la Tourette Syndrome	This study consists of three components. The first component includes genome-wide association study (GWAS) data on 695 TS cases and 198 ancestry matched controls from the first TS GWAS of  1285 TS cases and 4964 ancestry matched controls. The second component includes genome-wide association study (GWAS) data on 2106 TS cases from the
phs001381	Gut Microbiome and Types of Colorectal Polyps	Colorectal cancer is a heterogeneous disease arising from at least two precursors-the conventional adenoma and the serrated polyp. This dataset was used to test the relationship of the gut microbiota  to specific colorectal polyp types. We included samples from two independent study populations based at colonoscopy clinics: the Centers for Disease
phs001382	Reproductive Health in Men and Women with Vasculitis	The purpose of this study is to learn about reproductive health, including fertility and pregnancies, in people with vasculitis. All patients enrolled in the Vasculitis Clinical Research Consortium's Contact Registry  will be invited via email to participate in this study. The Contact Registry includes people who self-identify as having one of 11 vasculities: Beh
phs001383	Birth Defects: Moebius Syndrome and Related Congenital Facial Weakness    Disorders	It is estimated that about 1 in every 33 infants in the United States is born with a birth defect. Among these, the subset of birth defect syndromes associated with  facial weakness and lack of facial expression can have profound implications for social interactions and psychosocial development. Moebius syndrome
phs001384	Time Lapse to Cancer-Defining the Transition from Polyp to Cancer	In the US, CRC incidence has declined with uptake in colonoscopy for early detection and removal of polyps, the precursor lesion, can stop a cancer from developing but in spite  of this, CRC remains the second leading cause of cancer death in the United States. One third of people who undergo screening colonoscopy will have
phs001385	Ancestry Admixture among Chileans	The purpose of this study is to investigate ancestry admixture among Chileans with and without gallbladder cancer. All cases from the Chile Gallbladder Cancer Pilot and Expansion studies with available  genotype data. Principal Investigator: Jill Koshiol, PhD, National Institutes of Health, Bethesda, MD, USA Funding Source: Z01 CP010218, National
phs001386	Smoking and the Vaginal Microbiome	The focus of this study was to better understand the effects of cigarette smoking on the vaginal microbiome. There were two phases of the study, cross-sectional and longitudinal, conducted at  the Center for Health Behavior Research at the University of Maryland School of Public Health. In the cross-sectional phase, 20 smokers and 20 non
phs001387	NHLBI TOPMed: Rare Variants for Hypertension in Taiwan Chinese (THRV)	The THRV-TOPMed study consists of three cohorts: The SAPPHIRe Family cohort (N 1,271), TSGH (Tri-Service General Hospital, a hospital-based cohort, N 160), and TCVGH (Taichung Veterans General Hospital, another hospital-based  cohort, N 922), all based in Taiwan. 1,271 subjects were previously recruited as part of the NHLBI-sponsored SAPPHIRe Network (which is part of the
phs001388	Slim Initiative in Genomic Medicine for the Americas (SIGMA): Diabetes in    Mexico Study (DMS)	The 52,000 sample Type 2 Diabetes Exome Sequencing project is a collaboration of six consortia with various funding mechanisms that have joined together to investigate genetic variants for type 2  diabetes (T2D) using the largest T2D case/control sample set compiled to date. This includes samples from: Type 2 Diabetes Genetic Exploration by
phs001389	Gene Expression and Histone Modification Profiles in GBM Tumors	The primary goal of this study was to collect and analyze genomic data from primary glioblastoma multiforme tumors. Our collaborators at St David's Medical Center (SDMC) obtained informed consent from  patients undergoing surgery to remove a tumor in the brain. After consent was obtained, specimens were removed from the operating suite and flash
phs001391	OncoArray: Prostate Cancer	Original description of the study: From ELLIPSE (linked to the PRACTICAL consortium), we contributed 78,000 SNPs to the OncoArray. A large fraction of the content was derived from the GWAS  meta-analyses in European ancestry populations (overall and aggressive disease; 27K SNPs). We also selected just over 10,000 SNPs from the meta
phs001392	Natural History Study of SCID Disorders	Individuals, including infants who were identified by newborn screening, with a recent/new diagnosis of severe combined immune deficiency (SCID) may be eligible to be enrolled in the PIDTC research study:  A Prospective Natural History Study of Diagnosis, Treatment and Outcomes of Children with SCID Disorders. To determine eligibility for this study
phs001394	Hypertension-Insulin Resistance Family Study (HTN-IR)	The HTN-IR Study, funded by NHLBI, was designed to explore genetic contributions to hypertension and glucose homeostasis traits among Hispanics using a family-based design. The baseline examination of the cohort  included the euglycemic hyperinsulinemic clamp test from which the two key phenotypes were obtained: insulin sensitivity (M) and metabolic clearance
phs001395	NHLBI TOPMed - NHGRI CCDG: Hispanic Community Health Study/Study of    Latinos (HCHS/SOL)	This study contains whole genome sequence data. A case-control sample of individuals from the Hispanic Community Health Study/Study of Latinos (HCHS/SOL), a multicenter prospective cohort study of 16,415 persons of  Cuban, Dominican, Mexican, Puerto Rican, Central American, and South American background (phs000810), was selected for whole genome sequencing
phs001396	Genetics of Pigmentation in Eastern and Southern African Populations    Study	The goal of this study was to identify genes and loci associated with pigmentation in African populations. It comprises 1,593 participants from Ethiopia, Tanzania, and Botswana. Sexes are evenly represented  (768 males and 825 females) and self reported ages ranged from 18 to 103. Mean age was used for individuals without ages. For each participant, a DSM
phs001397	Mexican-American Coronary Artery Disease Study (MACAD)	The MACAD Study, funded by NHLBI, was designed to explore genetic contributions to coronary artery disease and glucose homeostasis traits among Hispanics using a family-based design. The baseline examination of  the cohort included the euglycemic hyperinsulinemic clamp test from which the two key phenotypes were obtained: insulin sensitivity (M) and metabolic
phs001398	Center for Common Disease Genomics [CCDG] - Cardiovascular: The    Bangladesh Risk of Acute Vascular Events (BRAVE) Study	The Bangladesh Risk of Acute Vascular Events (BRAVE) study is a hospital-based case-control study in Bangladesh which was established by the Cardiovascular Epidemiology Unit of Cambridge University in the UK  in partnership with the key local cardiology and research centres to examine environmental, genetic, lifestyle and biochemical determinants of
phs001399	Development of Precision Neoadjuvant-Adjuvant Therapies	In clinical trials assessing neoadjuvant androgen deprivation therapy plus next-generation androgen receptor axis inhibitors, a subset of patients fail to demonstrate a complete pathologic response following treatment and radical prostatectomy.  We performed exome and transcriptome analyses on laser capture microdissected foci of residual tumor from these patients. Patients with residual
phs001400	Advanced Genomic Techniques in Sequencing of Colorectal Cancer	We developed a method that uses allelic imbalance information in combination with phased genomic sequencing to generate mega-haplotypes that can encompass entire chromosome arms. We applied this technique to characterize  aneuploidy and chromosomal alterations in colorectal cancers. Principal Investigator: Hanlee P. Ji, MD, Stanford University School of Medicine
phs001402	NHLBI TOPMed: Whole Genome Sequencing of Venous Thromboembolism (WGS of    VTE)	This study consists of 338 VTE cases from an inception cohort of Olmsted County, MN residents (OC) with a first lifetime objectively-diagnosed idiopathic VTE during the 40-year study period, 1966-2005.  All living study subjects were invited to provide a whole blood sample at the Mayo Clinical Research Unit for leukocyte genomic DNA and plasma
phs001403	WES and CNV analysis of NF1-Associated Plexiform Neurofibromas	Neurofibromatosis type 1 (NF1) is a common tumor-predisposition disorder due to germline mutations in the tumor suppressor gene NF1. A virtually pathognomonic finding of NF1 is the plexiform neurofibroma (PN),  a benign, likely congenital tumor that arises from biallelic inactivation of NF1. PN can undergo transformation to a malignant peripheral nerve
phs001404	Molecular Profiling of Gallbladder Cancer (MPOG)	The purpose of this study is to investigate the underlying genetic factors involved in gallbladder cancer. All cases from the Shanghai Biliary Cancer Study and the Chile Gallbladder Cancer Pilot  Study with fresh frozen tissue that were included in the molecular profiling analysis. Principal Investigator: Jill Koshiol, PhD, National Institutes
phs001405	Defining the Triple Negative Breast Cancer Kinome Response to GSK1120212	"In this study the investigators looked at adaptive reprogramming impact on the kinome when a MEK inhibitor called GSK1120212 (trametinib) was administered in a ""window of opportunity"" trial. GSK1120212 is  not yet approved by the FDA for use in breast cancer patients. The investigators gave GSK1120212 for a short period of time (one week) to examine MEK"
phs001406	Duke Cognition Cohort	The overall goal is to identify genetic variants influencing normal variation between humans, with a focus on cognitive and neurosensory traits. Because of the focus of funding agencies on disease,  very few studies of the genetics of non-disease traits have been performed. The genetic variation underlying the vast majority of differences between
phs001407	HNPCC-Sys: Molecular Characterization of Lynch Syndromes	Lynch Syndrome (LS) tumors are characterized by constitutional mutations in DNA mismatch-repair genes. Colorectal cancers (CRCs) are the predominant tumor type in patients with LS. Here, we have used whole-genome  and transcriptome sequencing of LS- CRC to find similarities and differences of mutation and gene expression characteristics between LS-CRC and
phs001409	Genetic Risk Underlying Racial Disparities in Uterine Fibroids	Fibroids affect 77% of women by onset of menopause in the U.S. and account for $2.1 billion in healthcare costs each year. Fibroids negatively impact reproductive health causing heavy and  painful menses, pelvic pain and pressure, pregnancy complications, and interventions including myomectomy and hysterectomy. Until recently, tumor
phs001410	Kids First: Pediatric Research Project on Adolescent Idiopathic Scoliosis	The Gabriella Miller Kids First Pediatric Research Program (Kids First) is a trans-NIH effort initiated in response to the2014 Gabriella Miller Kids First Research Act and supported by the NIH  Common Fund. This program focuses on gene discovery in childhood cancers and structural birth defects and the development of the Gabriella Miller
phs001411	Action to Control Cardiovascular Risk in Diabetes (ACCORD)	The Action to Control Cardiovascular Risk in Diabetes (ACCORD) clinical trial was a randomized, multicenter, double 2 x 2 factorial design study involving 10,251 middle-aged and older participants with type-2  diabetes who are at high risk for CVD events because of existing CVD or additional risk factors. The purpose of ACCORD was to determine if intensive
phs001412	NHLBI TOPMed: Diabetes Heart Study (DHS) African American Coronary Artery    Calcification (AA CAC)	The Diabetes Heart Study (DHS) is a family-based study enriched for type 2 diabetes (T2D). The cohort included 1443 European American and African American participants from 564 families with multiple  cases of type 2 diabetes (Bowden et al., 2010. Review of Diabetic Studies 7:188-201. PMID: 21409311). The cohort was recruited between 1998 and 2006
phs001415	Uncovering the Genetic Architecture of Colorectal Cancer with Focus of    Rare and Less Frequent Variants	The Genetics and Epidemiology of Colorectal Cancer Consortium (GECCO) is a collaborative effort comprised of a coordinating center and scientific researchers from well-characterized cohort and case-control studies conducted in North  America and Europe. This international consortium aims to accelerate the discovery of common and rare genetic risk variants for colorectal cancer by
phs001416	NHLBI TOPMed: MESA and MESA Family AA-CAC	The Multi-Ethnic Study of Atherosclerosis (MESA) is a study of the characteristics of subclinical cardiovascular disease (disease detected non-invasively before it has produced clinical signs and symptoms) and the risk  factors that predict progression to clinically overt cardiovascular disease or progression of the subclinical disease. MESA researchers study a
phs001417	Scalable WES of cfDNA Reveals High Concordance with Metastatic Tumors	We performed whole genome sequencing and whole-exome sequencing of cell-free DNA (cfDNA) and whole-exome sequencing of matched tumor biopsies and germline DNA from patients with metastatic cancer. Using ichorCNA, a  software tool that quantifies tumor content in ultra-low pass whole genome sequencing ( 0.1x) of cfDNA without prior genomic characterization of the
phs001418	Molecular Role of DNA Variants Associated with Crohn's Disease	Crohn's disease (CD), one of the two major inflammatory bowel diseases (IBD), results from an inappropriately directed inflammatory response to the enteric microbiota in a genetically susceptible host. Genome wide  association studies (GWAS) have linked 200 specific single nucleotide polymorphisms (SNPs) to CD disease pathogenesis. Within these regions, there
phs001419	Natural History Study of Charcot-Marie-Tooth Disease	Charcot Marie Tooth disease (CMT) is an umbrella term that covers any inherited peripheral neuropathy. People with CMT have a problem with the nerves that go to the feet and  hands that cause muscle and sensation loss, as well as difficulty with balance. There are at least forty genes that, when mutated, cause CMT. The
phs001420	Kids First: Genomics of Orofacial Cleft Birth Defects in Latin American    Families	The Gabriella Miller Kids First Pediatric Research Program) (Kids First) is a trans-NIH effort initiated in response to the 2014 Gabriella Miller Kids First Research Act and supported by the  NIH Common Fund. This program focuses on gene discovery in pediatric cancers and structural birth defects and the development of the Gabriella Miller
phs001421	Whole Exome Sequencing and Methylation Profiling of Uveal Melanoma	Uveal melanoma (UM) is the most common primary cancer of the eye and frequently leads to metastatic death. Metastatic risk can be stratified into low, intermediate and high based on  the presence of mutually exclusive mutations in EIF1AX, SF3B1 and BAP1, respectively. The purpose of this study was to comprehensively profile the
phs001422	GEnomics and Transcriptomics of Human INsulinoma (GETHIN)	The Genomics and Transcriptomics of Human Insulinoma (GETHIN) The common forms of diabetes - Types 1 and 2 - ultimately result from a deficiency of insulin-producing pancreatic beta cells. The  Genomics and Transcriptomics of Human Insulinoma (GETHIN) study was performed in order to identify novel approaches to inducing human pancreatic beta
phs001423	Tourette International Collaborative Genetics (TIC Genetics) Study -    NJCTS and NIMH	The Tourette International Collaborative Genetics (TIC Genetics) Study is an international collaboration of scientists and clinicians specialized in Tourette Disorder (TD) from more than 20 sites across the United States,  Europe, and South Korea. The study was established to further our understanding of the genetic architecture of tic disorders by developing a large
phs001424	Genomic Analysis of Pre-Treatment and Autopsy Glioblastoma Specimens	We performed whole exome sequencing data of pre-treatment glioblastoma specimens, matched to post-treatment recurrent intracranial autopsy samples and metastatic extracranial post-treatment autopsy samples. We identified early genetic events common to  the evolutionary ancestry of both pre-treatment glioblastoma and later recurrences. We demonstrated that there were no protein-coding mutations as
phs001425	Melanoma Sequential Immune Checkpoint Blockade Treatment Sequencing Study	Blockade of T cell coinhibitory molecules such as CTLA-4 and PD-1, can activate T cell antitumor response. Although these immune checkpoint blockades (CTLA-4 blockade and PD-1 blockade) have shown durable  response, response rate is modest. Therefore, there is a need to find stable biomarkers predictive of response to immune checkpoint blockades and to
phs001426	Type 1 Diabetes Genetics Consortium (T1DGC): Case-only RNA-Seq Study	Peripheral blood mononuclear cells (PBMC) from 82 T1D cases from the T1DGC study were fractionated by positive selection on magnetic beads into CD4+ T cells, CD8+ T cells and CD19+  B cells. RNA purification, library preparation and sequencing to an average of 50 million reads per sample were performed by the HudsonAlpha Genome
phs001427	Resistance to Checkpoint Blockade Therapy Through Inactivation of Antigen    Presentation	Although immune checkpoint blockade (CPB) leads to prolonged responses in 15-40% of patients with metastatic melanoma, treatment refractory disease and progression after initial response remain major causes of mortality. While  predictors of response have been reported, the common mechanisms of both primary and acquired resistance are poorly understood. To identify
phs001428	GWAS for Breast Cancer Chemotherapy Toxicities in S0221	When undergoing treatment for breast cancer, many women experience severe side effects, some of which result in treatment-related death and some that can persist for years. Little is understood regarding  factors that may predict drug toxicities. Pharmacogenetics, the investigation of variants in candidate genes in drug metabolism pathways, has been
phs001430	STAIR SLOS Longitudinal Study of Patients Receiving Cholesterol	Smith-Lemli-Opitz syndrome (SLOS) is a disorder of cholesterol production by the body. It is caused by changes in the DHCR7 gene, which is the blueprint for an enzyme called 7-dehydrocholesterol-  delta7-reductase. This enzyme is necessary for the production of cholesterol by all cells in the body. People with SLOS often have malformations of
phs001431	Whole Exome and Whole Genome Profiling as well Genome-Wide Methylation    Profiling from Early to Advanced Chronic Lymphocytic leukemia (CLL),    Genome-Wide Methylation Profiling in Monoclonal B Cell Lymphocytosis    (MBL)	Serial whole exome sequencing of samples collected from 21 patients at multiple time points during progression from early to late chronic lymphocytic leukemia (CLL) and one matching non-tumor tissue sample  from each patient. Additional whole genome sequencing of samples from 3 selected patients. Genome-wide B cell methylation compared between 5 healthy
phs001432	Rapid Autopsy in Thoracic Malignancy Cancer Patients to Investigate Tumor    Heterogeneity	Integrated proteo-genomics studies to characterize tumor heterogeneity of metastatic lung adenocarcinoma and thymic carcinoma are lacking. We carried out whole exome sequencing, RNA sequencing, copy number estimation and mass spectrometry-based  proteomics of 40 tumors from five rapid/warm autopsy patients. We found highly variable mutational heterogeneity that was largely driven by APOBEC
